{
    "$schema": "https://raw.githubusercontent.com/martinring/tmlanguage/master/tmlanguage.json",
    "name": "SysML",
    "scopeName": "source.sysml",
    "patterns": [
        {
            "include": "#comments"
        },
        {
            "include": "#strings"
        },
        {
            "include": "#numbers"
        },
        {
            "include": "#constants"
        },
        {
            "include": "#def-declarations"
        },
        {
            "include": "#usage-declarations"
        },
        {
            "include": "#type-annotations"
        },
        {
            "include": "#modifiers"
        },
        {
            "include": "#control-keywords"
        },
        {
            "include": "#definition-keywords"
        },
        {
            "include": "#relationship-keywords"
        },
        {
            "include": "#other-keywords"
        },
        {
            "include": "#operators"
        },
        {
            "include": "#builtin-types"
        },
        {
            "include": "#punctuation"
        }
    ],
    "repository": {
        "comments": {
            "patterns": [
                {
                    "name": "comment.line.double-slash.sysml",
                    "match": "//.*$"
                },
                {
                    "name": "comment.block.sysml",
                    "begin": "/\\*",
                    "end": "\\*/"
                }
            ]
        },
        "strings": {
            "patterns": [
                {
                    "name": "string.quoted.double.sysml",
                    "begin": "\"",
                    "end": "\"",
                    "patterns": [
                        {
                            "name": "constant.character.escape.sysml",
                            "match": "\\\\."
                        }
                    ]
                },
                {
                    "name": "string.quoted.single.sysml",
                    "begin": "'",
                    "end": "'",
                    "patterns": [
                        {
                            "name": "constant.character.escape.sysml",
                            "match": "\\\\."
                        }
                    ]
                }
            ]
        },
        "numbers": {
            "patterns": [
                {
                    "name": "constant.numeric.float.sysml",
                    "match": "\\b\\d+\\.\\d+([eE][+-]?\\d+)?\\b"
                },
                {
                    "name": "constant.numeric.integer.sysml",
                    "match": "\\b\\d+\\b"
                }
            ]
        },
        "constants": {
            "patterns": [
                {
                    "name": "constant.language.sysml",
                    "match": "\\b(true|false|null)\\b"
                }
            ]
        },
        "def-declarations": {
            "comment": "keyword def Name — name is a type definition (teal/green in Dark+)",
            "patterns": [
                {
                    "comment": "Compound: use case def Name",
                    "match": "\\b(use\\s+case)\\s+(def)\\s+([a-zA-Z_][a-zA-Z0-9_]*)",
                    "captures": {
                        "1": {
                            "name": "keyword.other.definition.sysml"
                        },
                        "2": {
                            "name": "storage.type.def.sysml"
                        },
                        "3": {
                            "name": "entity.name.type.sysml"
                        }
                    }
                },
                {
                    "match": "\\b(package|part|port|item|attribute|action|calc|state|constraint|requirement|concern|case|analysis|verification|view|viewpoint|rendering|metadata|enum|datatype|allocation|connection|interface|occurrence|individual|flow|binding|succession)\\s+(def)\\s+([a-zA-Z_][a-zA-Z0-9_]*)",
                    "captures": {
                        "1": {
                            "name": "keyword.other.definition.sysml"
                        },
                        "2": {
                            "name": "storage.type.def.sysml"
                        },
                        "3": {
                            "name": "entity.name.type.sysml"
                        }
                    }
                }
            ]
        },
        "usage-declarations": {
            "comment": "keyword name (without def) — names get role-appropriate scopes",
            "patterns": [
                {
                    "comment": "include use case name — include relationship",
                    "match": "\\b(include)\\s+(use)\\s+(case)\\s+([a-zA-Z_][a-zA-Z0-9_]*)",
                    "captures": {
                        "1": {
                            "name": "keyword.control.sysml"
                        },
                        "2": {
                            "name": "keyword.other.definition.sysml"
                        },
                        "3": {
                            "name": "keyword.other.definition.sysml"
                        },
                        "4": {
                            "name": "variable.other.member.sysml"
                        }
                    }
                },
                {
                    "comment": "use case name (without def)",
                    "match": "\\b(use)\\s+(case)\\s+(?!def\\b)([a-zA-Z_][a-zA-Z0-9_]*)",
                    "captures": {
                        "1": {
                            "name": "keyword.other.definition.sysml"
                        },
                        "2": {
                            "name": "keyword.other.definition.sysml"
                        },
                        "3": {
                            "name": "variable.other.member.sysml"
                        }
                    }
                },
                {
                    "comment": "perform action name",
                    "match": "\\b(perform)\\s+(action)\\s+([a-zA-Z_][a-zA-Z0-9_]*)",
                    "captures": {
                        "1": {
                            "name": "keyword.control.sysml"
                        },
                        "2": {
                            "name": "keyword.other.definition.sysml"
                        },
                        "3": {
                            "name": "entity.name.function.sysml"
                        }
                    }
                },
                {
                    "comment": "exhibit state name",
                    "match": "\\b(exhibit)\\s+(state)\\s+([a-zA-Z_][a-zA-Z0-9_]*)",
                    "captures": {
                        "1": {
                            "name": "keyword.control.sysml"
                        },
                        "2": {
                            "name": "keyword.other.definition.sysml"
                        },
                        "3": {
                            "name": "variable.other.member.sysml"
                        }
                    }
                },
                {
                    "comment": "actor/subject name — participant (light blue in Dark+)",
                    "match": "\\b(actor|subject)\\s+([a-zA-Z_][a-zA-Z0-9_]*)(?!\\s+def\\b)",
                    "captures": {
                        "1": {
                            "name": "keyword.other.definition.sysml"
                        },
                        "2": {
                            "name": "variable.other.member.sysml"
                        }
                    }
                },
                {
                    "comment": "package/namespace Name — namespace (teal in Dark+)",
                    "match": "\\b(package|namespace|library)\\s+([a-zA-Z_][a-zA-Z0-9_]*)(?!\\s+def\\b)",
                    "captures": {
                        "1": {
                            "name": "keyword.other.definition.sysml"
                        },
                        "2": {
                            "name": "entity.name.namespace.sysml"
                        }
                    }
                },
                {
                    "comment": "action/calc name — function-like (yellow in Dark+)",
                    "match": "\\b(action|calc|analysis|verification)\\s+([a-zA-Z_][a-zA-Z0-9_]*)(?!\\s+def\\b)",
                    "captures": {
                        "1": {
                            "name": "keyword.other.definition.sysml"
                        },
                        "2": {
                            "name": "entity.name.function.sysml"
                        }
                    }
                },
                {
                    "comment": "part/port/item/datatype name — member (light blue in Dark+)",
                    "match": "\\b(part|port|item|state|constraint|requirement|concern|case|view|viewpoint|rendering|allocation|connection|interface|occurrence|individual|flow|binding|succession|metadata|enum|datatype)\\s+([a-zA-Z_][a-zA-Z0-9_]*)(?!\\s+def\\b)",
                    "captures": {
                        "1": {
                            "name": "keyword.other.definition.sysml"
                        },
                        "2": {
                            "name": "variable.other.member.sysml"
                        }
                    }
                },
                {
                    "comment": "attribute name — property (light blue in Dark+)",
                    "match": "\\b(attribute)\\s+([a-zA-Z_][a-zA-Z0-9_]*)(?!\\s+def\\b)",
                    "captures": {
                        "1": {
                            "name": "keyword.other.definition.sysml"
                        },
                        "2": {
                            "name": "variable.other.property.sysml"
                        }
                    }
                }